{
  "$schema": "http://json-schema.org/draft-07/schema#",
  "$id": "shared/figma-jutro-handoff.schema.json",
  "title": "Figma Jutro Handoff",
  "description": "Schema for the JSON handoff file exported by Alchemy Journey Studio and consumed by the Alchemy Journey to Figma plugin.",
  "version": "1.0",
  "type": "object",
  "required": ["format", "version", "generatedAt", "journey"],
  "additionalProperties": false,
  "properties": {
    "format": {
      "type": "string",
      "const": "figma-jutro-handoff",
      "description": "Fixed identifier that identifies this file as an Alchemy Journey Studio handoff."
    },
    "version": {
      "type": "string",
      "const": "1.0",
      "description": "Handoff format version. The Figma plugin must check this before importing."
    },
    "generatedAt": {
      "type": "string",
      "format": "date-time",
      "description": "ISO 8601 timestamp of when the handoff was exported."
    },
    "journey": {
      "type": "object",
      "required": ["id", "name", "status", "figmaPageName", "designSystem", "responsiveFrames", "screens"],
      "additionalProperties": false,
      "properties": {
        "id": {
          "type": "string",
          "description": "URL-safe slug derived from the journey name, e.g. 'motor-claims-fnol-journey'."
        },
        "name": {
          "type": "string",
          "description": "Human-readable journey name, e.g. 'Motor Claims FNOL Journey'."
        },
        "status": {
          "type": "string",
          "enum": ["draft", "review", "approved", "exported"],
          "description": "Approval status of the journey at the time of export."
        },
        "figmaPageName": {
          "type": "string",
          "description": "Suggested Figma page name for the plugin to create, e.g. 'Motor Claims FNOL Journey / Generated screens'."
        },
        "designSystem": {
          "type": "object",
          "required": ["name", "status"],
          "additionalProperties": false,
          "properties": {
            "name": {
              "type": "string",
              "description": "Name of the design system the component mappings are based on."
            },
            "status": {
              "type": "string",
              "description": "Advisory note about component mapping accuracy."
            }
          }
        },
        "responsiveFrames": {
          "type": "array",
          "description": "List of responsive frame sizes the plugin should generate. Version 1 produces Desktop only.",
          "minItems": 1,
          "items": {
            "type": "object",
            "required": ["name", "width"],
            "additionalProperties": false,
            "properties": {
              "name": {
                "type": "string",
                "description": "Display name, e.g. 'Desktop'."
              },
              "width": {
                "type": "integer",
                "description": "Frame width in pixels, e.g. 1440."
              }
            }
          }
        },
        "screens": {
          "type": "array",
          "description": "Ordered list of journey screens. The plugin creates one Figma frame per screen.",
          "minItems": 1,
          "items": { "$ref": "#/definitions/screen" }
        }
      }
    }
  },
  "definitions": {
    "screen": {
      "type": "object",
      "required": ["id", "order", "name", "figmaFrameName", "description", "layout", "fields", "conditionalSections", "actions", "prototype"],
      "additionalProperties": false,
      "properties": {
        "id": {
          "type": "string",
          "description": "Unique screen identifier generated by Journey Studio."
        },
        "order": {
          "type": "integer",
          "minimum": 1,
          "description": "1-based position of this screen in the journey."
        },
        "name": {
          "type": "string",
          "description": "Screen name shown in the stepper and Figma frame name, e.g. 'Incident details'."
        },
        "figmaFrameName": {
          "type": "string",
          "description": "Suggested Figma frame name, e.g. 'Journey / Incident details'."
        },
        "description": {
          "type": "string",
          "description": "Instructional subtitle shown below the screen heading."
        },
        "layout": {
          "type": "object",
          "required": ["type", "columns"],
          "additionalProperties": false,
          "properties": {
            "type": {
              "type": "string",
              "const": "form",
              "description": "Layout type. Version 1 supports 'form' only."
            },
            "columns": {
              "type": "object",
              "required": ["desktop"],
              "additionalProperties": false,
              "properties": {
                "desktop": {
                  "type": "integer",
                  "const": 2,
                  "description": "Number of columns in the desktop layout. Version 1 is always 2."
                }
              }
            }
          }
        },
        "fields": {
          "type": "array",
          "description": "Primary (always-visible) fields on this screen.",
          "items": { "$ref": "#/definitions/field" }
        },
        "conditionalSections": {
          "type": "array",
          "description": "Sections that are shown only when a trigger field equals a specific value.",
          "items": { "$ref": "#/definitions/conditionalSection" }
        },
        "actions": {
          "type": "array",
          "description": "Buttons displayed at the bottom of the screen.",
          "minItems": 1,
          "items": { "$ref": "#/definitions/action" }
        },
        "prototype": {
          "type": "object",
          "required": ["backScreenId", "nextScreenId"],
          "additionalProperties": false,
          "properties": {
            "backScreenId": {
              "type": ["string", "null"],
              "description": "ID of the previous screen, or null if this is the first screen."
            },
            "nextScreenId": {
              "type": ["string", "null"],
              "description": "ID of the next screen, or null if this is the last screen."
            }
          }
        }
      }
    },
    "field": {
      "type": "object",
      "required": ["id", "label", "inputType", "required", "options", "figmaComponent", "jutroComponent", "cssClass", "states"],
      "additionalProperties": false,
      "properties": {
        "id": {
          "type": "string",
          "description": "Unique field identifier generated by Journey Studio."
        },
        "label": {
          "type": "string",
          "description": "Human-readable field label shown above the input, e.g. 'Date of incident'."
        },
        "inputType": {
          "type": "string",
          "enum": ["text", "email", "tel", "date", "select", "textarea", "number"],
          "description": "Input type. Maps to a Jutro form component and a Figma component."
        },
        "required": {
          "type": "boolean",
          "description": "Whether the field is mandatory."
        },
        "options": {
          "type": "array",
          "description": "Dropdown options for 'select' fields. Empty array for all other types.",
          "items": { "type": "string" }
        },
        "figmaComponent": {
          "type": "string",
          "description": "Figma component key to use, e.g. 'Form / Text Input'. Must be verified against the approved Figma library."
        },
        "jutroComponent": {
          "type": "string",
          "description": "Jutro React component name, e.g. 'TextInput'. Must be verified against the approved Jutro library."
        },
        "cssClass": {
          "type": "string",
          "description": "CSS class applied to the component, e.g. 'jutro-text-input'."
        },
        "states": {
          "type": "object",
          "required": ["default", "required", "error", "disabled"],
          "additionalProperties": false,
          "description": "Which Figma component states the plugin should generate for this field.",
          "properties": {
            "default": {
              "type": "boolean",
              "description": "Generate the default (empty) state."
            },
            "required": {
              "type": "boolean",
              "description": "Generate the required-field state (asterisk label)."
            },
            "error": {
              "type": "boolean",
              "description": "Generate the validation error state."
            },
            "disabled": {
              "type": "boolean",
              "description": "Generate the disabled state."
            }
          }
        }
      }
    },
    "conditionalSection": {
      "type": "object",
      "required": ["id", "sectionName", "visibleWhen", "fields"],
      "additionalProperties": false,
      "properties": {
        "id": {
          "type": "string",
          "description": "Unique rule identifier generated by Journey Studio."
        },
        "sectionName": {
          "type": "string",
          "description": "Heading shown above the conditional section, e.g. 'Urgent request details'."
        },
        "visibleWhen": {
          "type": "object",
          "required": ["fieldId", "fieldLabel", "equals"],
          "additionalProperties": false,
          "description": "The condition that must be true for this section to appear.",
          "properties": {
            "fieldId": {
              "type": "string",
              "description": "ID of the trigger field."
            },
            "fieldLabel": {
              "type": "string",
              "description": "Label of the trigger field (for display purposes)."
            },
            "equals": {
              "type": "string",
              "description": "The answer value that triggers this section, e.g. 'Yes'."
            }
          }
        },
        "fields": {
          "type": "array",
          "description": "Fields shown inside this conditional section.",
          "minItems": 1,
          "items": { "$ref": "#/definitions/field" }
        }
      }
    },
    "action": {
      "type": "object",
      "required": ["id", "label", "actionType", "figmaComponent", "jutroComponent", "variant"],
      "additionalProperties": false,
      "properties": {
        "id": {
          "type": "string",
          "description": "Unique action identifier generated by Journey Studio."
        },
        "label": {
          "type": "string",
          "description": "Button label, e.g. 'Continue' or 'Save and continue later'."
        },
        "actionType": {
          "type": "string",
          "enum": ["back", "save", "continue"],
          "description": "Semantic action type. 'back' navigates to the previous screen, 'save' saves a draft, 'continue' validates and advances."
        },
        "figmaComponent": {
          "type": "string",
          "description": "Figma component key, e.g. 'Button / Primary'."
        },
        "jutroComponent": {
          "type": "string",
          "description": "Jutro React component name. Always 'Button' in Version 1."
        },
        "variant": {
          "type": "string",
          "enum": ["primary", "secondary"],
          "description": "Button variant. 'continue' maps to 'primary'; 'back' and 'save' map to 'secondary'."
        }
      }
    }
  }
}
